[
  {
    "title": "Joulukirkkokalenteri 25.12.2024",
    "link": "http://suomensukututkimusseura.blogspot.com/2024/12/joulukirkkokalenteri-25122024.html",
    "pubDate": "2024-12-25T10:00:00.024Z",
    "content": "<html><head></head><body><p><span><b><span>&nbsp;<br></span></b></span></p><div class=\"separator\"><span><b><a href=\"https://blogger.googleusercontent.com/img/b/R29vZ2xl/AVvXsEhMtA5yQ6N1Zey4OPt1xhfZ8NiRG-xjZONRhGHD8y8NeIXXi8OfsdJ87GzV5oDQr9tvqma93ntU2dNiRt8tcDmDcgLgZH7yIt4W0VfT4Lfj1ZLNBhksHNJM5VQNJtkSvyU2kEC84F2_TZPHzGPGw5qSSkd_A3KqNRwjNDfyD5Rx6u5zP2Kduwq8xTEpf2A/s622/luukkuun25.png\" imageanchor=\"1\"><img border=\"0\" data-original-height=\"406\" data-original-width=\"622\" height=\"209\" src=\"https://blo...",
    "creator": "Tiina Miettinen",
    "sourceTitle": "Suomen Sukututkimusseura",
    "sheetCategory": "Digital skills + Citizen science",
    "enforcedImage": "https://blogger.googleusercontent.com/img/b/R29vZ2xl/AVvXsEhMtA5yQ6N1Zey4OPt1xhfZ8NiRG-xjZONRhGHD8y8NeIXXi8OfsdJ87GzV5oDQr9tvqma93ntU2dNiRt8tcDmDcgLgZH7yIt4W0VfT4Lfj1ZLNBhksHNJM5VQNJtkSvyU2kEC84F2_TZPHzGPGw5qSSkd_A3KqNRwjNDfyD5Rx6u5zP2Kduwq8xTEpf2A/s72-c/luukkuun25.png",
    "sourceDescription": "",
    "sourceLogo": "https://www.google.com/s2/favicons?sz=128&domain=suomensukututkimusseura.blogspot.com",
    "lang": "fi",
    "scope": "Finland",
    "isDarkLogo": false,
    "originalRssUrl": "http://suomensukututkimusseura.blogspot.com/feeds/posts/default"
  },
  {
    "title": "Joulukirkkokalenteri 24.12.2024",
    "link": "http://suomensukututkimusseura.blogspot.com/2024/12/joulukirkkokalenteri-24122024.html",
    "pubDate": "2024-12-24T10:00:00.061Z",
    "content": "<html><head></head><body><p>&nbsp;</p><div class=\"separator\"><a href=\"https://blogger.googleusercontent.com/img/b/R29vZ2xl/AVvXsEg4brvHBwiHx3vp1MCRN32pwow3qO5IdaQO120MBvwdn25Krn_JTgAbdIk64k20dztVN_8ipKREVAQ7ZPaIQ-vI9u5xjHSIJmnXQGPJX1jnIh-Qhki7DbgjnQtKas-MwxHe51YNQhVmhZrqwXGnMXvCzNGQj8YQfaD97xXUBkeRaCFsVQdlcAqR0JXNs5I/s726/24%20luukku.jpg\"><img border=\"0\" data-original-height=\"398\" data-original-width=\"726\" height=\"175\" src=\"https://blogger.googleusercontent.com/img/b/R29vZ2xl/AVvXsEg4brvHBwiHx3v...",
    "creator": "Tiina Miettinen",
    "sourceTitle": "Suomen Sukututkimusseura",
    "sheetCategory": "Digital skills + Citizen science",
    "enforcedImage": "https://blogger.googleusercontent.com/img/b/R29vZ2xl/AVvXsEg4brvHBwiHx3vp1MCRN32pwow3qO5IdaQO120MBvwdn25Krn_JTgAbdIk64k20dztVN_8ipKREVAQ7ZPaIQ-vI9u5xjHSIJmnXQGPJX1jnIh-Qhki7DbgjnQtKas-MwxHe51YNQhVmhZrqwXGnMXvCzNGQj8YQfaD97xXUBkeRaCFsVQdlcAqR0JXNs5I/s72-c/24%20luukku.jpg",
    "sourceDescription": "",
    "sourceLogo": "https://www.google.com/s2/favicons?sz=128&domain=suomensukututkimusseura.blogspot.com",
    "lang": "fi",
    "scope": "Finland",
    "isDarkLogo": false,
    "originalRssUrl": "http://suomensukututkimusseura.blogspot.com/feeds/posts/default"
  },
  {
    "title": "Joulukirkkokalenteri 23.12.2024",
    "link": "http://suomensukututkimusseura.blogspot.com/2024/12/joulukirkkokalenteri-23122024.html",
    "pubDate": "2024-12-23T10:00:00.016Z",
    "content": "<html><head></head><body><p><br></p><div class=\"separator\"><a href=\"https://blogger.googleusercontent.com/img/b/R29vZ2xl/AVvXsEjgLoMGomQacbMVqgkSNFOPLit7dQPL3g6qOD1R1tK57C_dBc1H2hyrurszku3OK08PlxH0C0Py_98JvrHGaQ7E7-UtwQzDxHcJMRi4k7w4UfIRPOzw1I_w-wcsR-AXMAFD_UFGMoHBtAYRsSKY8nTiSv2OFaWp7MH2gKgAp_aUU9Seh1pRiDN2FU6ztN8/s544/23%20luukku.jpg\"><img border=\"0\" data-original-height=\"306\" data-original-width=\"544\" height=\"180\" src=\"https://blogger.googleusercontent.com/img/b/R29vZ2xl/AVvXsEjgLoMGomQacbMVq...",
    "creator": "Tiina Miettinen",
    "sourceTitle": "Suomen Sukututkimusseura",
    "sheetCategory": "Digital skills + Citizen science",
    "enforcedImage": "https://blogger.googleusercontent.com/img/b/R29vZ2xl/AVvXsEjgLoMGomQacbMVqgkSNFOPLit7dQPL3g6qOD1R1tK57C_dBc1H2hyrurszku3OK08PlxH0C0Py_98JvrHGaQ7E7-UtwQzDxHcJMRi4k7w4UfIRPOzw1I_w-wcsR-AXMAFD_UFGMoHBtAYRsSKY8nTiSv2OFaWp7MH2gKgAp_aUU9Seh1pRiDN2FU6ztN8/s72-c/23%20luukku.jpg",
    "sourceDescription": "",
    "sourceLogo": "https://www.google.com/s2/favicons?sz=128&domain=suomensukututkimusseura.blogspot.com",
    "lang": "fi",
    "scope": "Finland",
    "isDarkLogo": false,
    "originalRssUrl": "http://suomensukututkimusseura.blogspot.com/feeds/posts/default"
  },
  {
    "title": "Joulukirkkokalenteri 22.12.2024",
    "link": "http://suomensukututkimusseura.blogspot.com/2024/12/joulukirkkokalenteri-22122024.html",
    "pubDate": "2024-12-22T10:00:00.001Z",
    "content": "<html><head></head><body><p></p><div class=\"separator\"><a href=\"https://blogger.googleusercontent.com/img/b/R29vZ2xl/AVvXsEgTqyNS-A4PLSIS-gnLWYiYJ148jL9gHL9pXTpcEyMU367iCK353itJGohY5mHWbEeH8k2c7-hSqdn8reMr0lSvNApiMfTduB2xCdTCjoM53wcNlEaK96apdSwJdhyiweeJiAlkWMMbEF5UtQ5aPKNaPbfWCMflM6gSm_L_k3oZwZakYTesjPIFb4CeCTE/s544/22%20luukku.jpg\" imageanchor=\"1\"><img border=\"0\" data-original-height=\"306\" data-original-width=\"544\" height=\"180\" src=\"https://blogger.googleusercontent.com/img/b/R29vZ2xl/AVvXsEgTq...",
    "creator": "Tiina Miettinen",
    "sourceTitle": "Suomen Sukututkimusseura",
    "sheetCategory": "Digital skills + Citizen science",
    "enforcedImage": "https://blogger.googleusercontent.com/img/b/R29vZ2xl/AVvXsEgTqyNS-A4PLSIS-gnLWYiYJ148jL9gHL9pXTpcEyMU367iCK353itJGohY5mHWbEeH8k2c7-hSqdn8reMr0lSvNApiMfTduB2xCdTCjoM53wcNlEaK96apdSwJdhyiweeJiAlkWMMbEF5UtQ5aPKNaPbfWCMflM6gSm_L_k3oZwZakYTesjPIFb4CeCTE/s72-c/22%20luukku.jpg",
    "sourceDescription": "",
    "sourceLogo": "https://www.google.com/s2/favicons?sz=128&domain=suomensukututkimusseura.blogspot.com",
    "lang": "fi",
    "scope": "Finland",
    "isDarkLogo": false,
    "originalRssUrl": "http://suomensukututkimusseura.blogspot.com/feeds/posts/default"
  },
  {
    "title": "Joulukirkkokalenteri 21.12.2024",
    "link": "http://suomensukututkimusseura.blogspot.com/2024/12/joulukirkkokalenteri-21122024.html",
    "pubDate": "2024-12-21T10:00:00.015Z",
    "content": "<html><head></head><body><p>&nbsp;</p><div class=\"separator\"><a href=\"https://blogger.googleusercontent.com/img/b/R29vZ2xl/AVvXsEgRCFSQX8SbrDY5bkwrbV_ujMefFFQDgCTwIpVovoLM6VfKMVuRvh6u2yhbjJzkbzhWCfrEkV1JSD8QSSaih566nD3Nj4tIhTGnX3-xSFAZ5vCEN2K-JoLpI8OChuJooLULxwMrEn2oOCHdVptQRQWcsYJqDwWqJ4kMr6-x4PBCTlAn0pwjGN0xRd5Fw60/s544/21%20luukku.jpg\"><img border=\"0\" data-original-height=\"306\" data-original-width=\"544\" height=\"180\" src=\"https://blogger.googleusercontent.com/img/b/R29vZ2xl/AVvXsEgRCFSQX8SbrDY...",
    "creator": "Tiina Miettinen",
    "sourceTitle": "Suomen Sukututkimusseura",
    "sheetCategory": "Digital skills + Citizen science",
    "enforcedImage": "https://blogger.googleusercontent.com/img/b/R29vZ2xl/AVvXsEgRCFSQX8SbrDY5bkwrbV_ujMefFFQDgCTwIpVovoLM6VfKMVuRvh6u2yhbjJzkbzhWCfrEkV1JSD8QSSaih566nD3Nj4tIhTGnX3-xSFAZ5vCEN2K-JoLpI8OChuJooLULxwMrEn2oOCHdVptQRQWcsYJqDwWqJ4kMr6-x4PBCTlAn0pwjGN0xRd5Fw60/s72-c/21%20luukku.jpg",
    "sourceDescription": "",
    "sourceLogo": "https://www.google.com/s2/favicons?sz=128&domain=suomensukututkimusseura.blogspot.com",
    "lang": "fi",
    "scope": "Finland",
    "isDarkLogo": false,
    "originalRssUrl": "http://suomensukututkimusseura.blogspot.com/feeds/posts/default"
  },
  {
    "title": "Joulukirkkokalenteri 20.12.2024",
    "link": "http://suomensukututkimusseura.blogspot.com/2024/12/joulukirkkokalenteri-20122024.html",
    "pubDate": "2024-12-20T10:00:00.010Z",
    "content": "<html><head></head><body><p><br></p><div class=\"separator\"><a href=\"https://blogger.googleusercontent.com/img/b/R29vZ2xl/AVvXsEjhyphenhyphenFcrwxat-lNBsgKw7PO0MaAQJKI88WjTycTA-UdVWvL6DDEbI65E5Bl-CAvmS8lpSmtlevWMvBHwzBp_LI1jIoWnUDbF1ZkiQuysAVm-UJYF03o0w8x_9Y1jqi4egvDlEzFxaWfVVJfqMOGAV-DdpMyW7UF6gMJCf_7SIJRpa7HZ4lyg7ToWnfhDx44/s544/20%20luukku.jpg\"><img border=\"0\" data-original-height=\"306\" data-original-width=\"544\" height=\"180\" src=\"https://blogger.googleusercontent.com/img/b/R29vZ2xl/AVvXsEjhyph...",
    "creator": "Tiina Miettinen",
    "sourceTitle": "Suomen Sukututkimusseura",
    "sheetCategory": "Digital skills + Citizen science",
    "enforcedImage": "https://blogger.googleusercontent.com/img/b/R29vZ2xl/AVvXsEjhyphenhyphenFcrwxat-lNBsgKw7PO0MaAQJKI88WjTycTA-UdVWvL6DDEbI65E5Bl-CAvmS8lpSmtlevWMvBHwzBp_LI1jIoWnUDbF1ZkiQuysAVm-UJYF03o0w8x_9Y1jqi4egvDlEzFxaWfVVJfqMOGAV-DdpMyW7UF6gMJCf_7SIJRpa7HZ4lyg7ToWnfhDx44/s72-c/20%20luukku.jpg",
    "sourceDescription": "",
    "sourceLogo": "https://www.google.com/s2/favicons?sz=128&domain=suomensukututkimusseura.blogspot.com",
    "lang": "fi",
    "scope": "Finland",
    "isDarkLogo": false,
    "originalRssUrl": "http://suomensukututkimusseura.blogspot.com/feeds/posts/default"
  },
  {
    "title": "Joulukirkkokalenteri 19.12.2024",
    "link": "http://suomensukututkimusseura.blogspot.com/2024/12/joulukirkkokalenteri-19122024.html",
    "pubDate": "2024-12-19T10:00:00.029Z",
    "content": "<html><head></head><body><p>&nbsp;</p><div class=\"separator\"><a href=\"https://blogger.googleusercontent.com/img/b/R29vZ2xl/AVvXsEgRm24AC7VVo7qUNJF7lasnaqPlgOrZn4Yzi65kc6ZI-thUAbhbZaqJLqNkWL2UupzdDRw0VI3M4hYrOiArXvWQJZ2UfDHaCZatiuq59AUpVRkWUmvVXRtajA5JfrnmFv_-OpfGBDU-bnU1OiwmGENwCUC6x4AIfY_7PlLYi2r4W7CFUkRKrFqmrwNw6QQ/s544/19%20luukku.jpg\"><img border=\"0\" data-original-height=\"306\" data-original-width=\"544\" height=\"180\" src=\"https://blogger.googleusercontent.com/img/b/R29vZ2xl/AVvXsEgRm24AC7VVo7q...",
    "creator": "Tiina Miettinen",
    "sourceTitle": "Suomen Sukututkimusseura",
    "sheetCategory": "Digital skills + Citizen science",
    "enforcedImage": "https://blogger.googleusercontent.com/img/b/R29vZ2xl/AVvXsEgRm24AC7VVo7qUNJF7lasnaqPlgOrZn4Yzi65kc6ZI-thUAbhbZaqJLqNkWL2UupzdDRw0VI3M4hYrOiArXvWQJZ2UfDHaCZatiuq59AUpVRkWUmvVXRtajA5JfrnmFv_-OpfGBDU-bnU1OiwmGENwCUC6x4AIfY_7PlLYi2r4W7CFUkRKrFqmrwNw6QQ/s72-c/19%20luukku.jpg",
    "sourceDescription": "",
    "sourceLogo": "https://www.google.com/s2/favicons?sz=128&domain=suomensukututkimusseura.blogspot.com",
    "lang": "fi",
    "scope": "Finland",
    "isDarkLogo": false,
    "originalRssUrl": "http://suomensukututkimusseura.blogspot.com/feeds/posts/default"
  },
  {
    "title": "Joulukirkkokalenteri 18.12.2024",
    "link": "http://suomensukututkimusseura.blogspot.com/2024/12/joulukirkkokalenteri-18122024.html",
    "pubDate": "2024-12-18T10:00:00.011Z",
    "content": "<html><head></head><body><p>&nbsp;</p><div class=\"separator\"><a href=\"https://blogger.googleusercontent.com/img/b/R29vZ2xl/AVvXsEjYZmTk6Yu0fmLvWVhsdJbLKoMSat4YfnrKsHi03-VXP2eugHFOqXlzkboLse8uvWt_pQB_Z7ID9a4x1t6ahyphenhypheneMDBYDY7k3onW7IKhfyvJ0o5E8TXAJaQdlDJOZd1pms1t84XV7AKZ3inB-WtD8GTI0SlEflA7N3xI2B-kyVF1_v10c3id15MLTBB6B8zE/s544/18%20luukku.jpg\"><img border=\"0\" data-original-height=\"306\" data-original-width=\"544\" height=\"180\" src=\"https://blogger.googleusercontent.com/img/b/R29vZ2xl/AVvXsEjYZ...",
    "creator": "Tiina Miettinen",
    "sourceTitle": "Suomen Sukututkimusseura",
    "sheetCategory": "Digital skills + Citizen science",
    "enforcedImage": "https://blogger.googleusercontent.com/img/b/R29vZ2xl/AVvXsEjYZmTk6Yu0fmLvWVhsdJbLKoMSat4YfnrKsHi03-VXP2eugHFOqXlzkboLse8uvWt_pQB_Z7ID9a4x1t6ahyphenhypheneMDBYDY7k3onW7IKhfyvJ0o5E8TXAJaQdlDJOZd1pms1t84XV7AKZ3inB-WtD8GTI0SlEflA7N3xI2B-kyVF1_v10c3id15MLTBB6B8zE/s72-c/18%20luukku.jpg",
    "sourceDescription": "",
    "sourceLogo": "https://www.google.com/s2/favicons?sz=128&domain=suomensukututkimusseura.blogspot.com",
    "lang": "fi",
    "scope": "Finland",
    "isDarkLogo": false,
    "originalRssUrl": "http://suomensukututkimusseura.blogspot.com/feeds/posts/default"
  },
  {
    "title": "Joulukirkkokalenteri 17.12.2024",
    "link": "http://suomensukututkimusseura.blogspot.com/2024/12/joulukirkkokalenteri-17122024.html",
    "pubDate": "2024-12-17T10:00:00.009Z",
    "content": "<html><head></head><body><p></p><div class=\"separator\"><a href=\"https://blogger.googleusercontent.com/img/b/R29vZ2xl/AVvXsEgPdBWmMqZTwZVVT8GQnzj8alfhdPLz0Bmmrerq8F6Bo3rKFSBOxb9CHDRShIhE4N1oCmx-NlwW1c5iBKsj8Lrr08ZJdP8TGo_24zvS8XigL95v2L2_6nc-bnttrS_Usk8r1TGwEmujX0zxUn_vr9C7PbKkdb3A7jSusWXnKu9EfuKpDaakH1Yklt_FCgY/s544/17%20luukku.jpg\"><img border=\"0\" data-original-height=\"306\" data-original-width=\"544\" height=\"180\" src=\"https://blogger.googleusercontent.com/img/b/R29vZ2xl/AVvXsEgPdBWmMqZTwZVVT8GQn...",
    "creator": "Tiina Miettinen",
    "sourceTitle": "Suomen Sukututkimusseura",
    "sheetCategory": "Digital skills + Citizen science",
    "enforcedImage": "https://blogger.googleusercontent.com/img/b/R29vZ2xl/AVvXsEgPdBWmMqZTwZVVT8GQnzj8alfhdPLz0Bmmrerq8F6Bo3rKFSBOxb9CHDRShIhE4N1oCmx-NlwW1c5iBKsj8Lrr08ZJdP8TGo_24zvS8XigL95v2L2_6nc-bnttrS_Usk8r1TGwEmujX0zxUn_vr9C7PbKkdb3A7jSusWXnKu9EfuKpDaakH1Yklt_FCgY/s72-c/17%20luukku.jpg",
    "sourceDescription": "",
    "sourceLogo": "https://www.google.com/s2/favicons?sz=128&domain=suomensukututkimusseura.blogspot.com",
    "lang": "fi",
    "scope": "Finland",
    "isDarkLogo": false,
    "originalRssUrl": "http://suomensukututkimusseura.blogspot.com/feeds/posts/default"
  },
  {
    "title": "Joulukirkkokalenteri 16.12.2024",
    "link": "http://suomensukututkimusseura.blogspot.com/2024/12/joulukirkkokalenteri-16122024.html",
    "pubDate": "2024-12-16T10:00:00.016Z",
    "content": "<html><head></head><body><p>&nbsp;</p><div class=\"separator\"><a href=\"https://blogger.googleusercontent.com/img/b/R29vZ2xl/AVvXsEhAyQYFc9vWYgys3oDvT_Z2xz45WNxetcS1Up2XF72japjV5no3q0v79bFOL6DQMh4imyE7Eiv6f2EHVUf8WC79eLFvFsH-SWITMYvLi5jLpfRKbPQiFTEUsuOIy7UvI7SyyQmIs3N5H2ayQMxkRvReKZfBtry3kL3XlIWjsBixLTbOkb8l2FBDefhuyR0/s544/Luukku%2016.jpg\"><img border=\"0\" data-original-height=\"306\" data-original-width=\"544\" height=\"180\" src=\"https://blogger.googleusercontent.com/img/b/R29vZ2xl/AVvXsEhAyQYFc9vWYgy...",
    "creator": "Tiina Miettinen",
    "sourceTitle": "Suomen Sukututkimusseura",
    "sheetCategory": "Digital skills + Citizen science",
    "enforcedImage": "https://blogger.googleusercontent.com/img/b/R29vZ2xl/AVvXsEhAyQYFc9vWYgys3oDvT_Z2xz45WNxetcS1Up2XF72japjV5no3q0v79bFOL6DQMh4imyE7Eiv6f2EHVUf8WC79eLFvFsH-SWITMYvLi5jLpfRKbPQiFTEUsuOIy7UvI7SyyQmIs3N5H2ayQMxkRvReKZfBtry3kL3XlIWjsBixLTbOkb8l2FBDefhuyR0/s72-c/Luukku%2016.jpg",
    "sourceDescription": "",
    "sourceLogo": "https://www.google.com/s2/favicons?sz=128&domain=suomensukututkimusseura.blogspot.com",
    "lang": "fi",
    "scope": "Finland",
    "isDarkLogo": false,
    "originalRssUrl": "http://suomensukututkimusseura.blogspot.com/feeds/posts/default"
  },
  {
    "title": "Joulukirkkokalenteri 15.12.2024",
    "link": "http://suomensukututkimusseura.blogspot.com/2024/12/joulukirkkokalenteri-15122024.html",
    "pubDate": "2024-12-15T10:00:00.057Z",
    "content": "<html><head></head><body><p>&nbsp;</p><div class=\"separator\"><a href=\"https://blogger.googleusercontent.com/img/b/R29vZ2xl/AVvXsEi6EYdbkaGOdN0SfrgKjMrQhQGpRnz5NBNpcJ_gATkTRD9KTFUbtwihlss8lRynHkdnxrFzGgcWZwYLrjfKtmQjdHA-_rHRw33FoTk0qMmk1HZ0BmDniE5ZngtKQ-OJpAi0Jqq2b9UPHNiQvk7yLM-BljqWOqEt2aqIY8AgZ5n7mpRkH-xZbbqN4sgvOVk/s544/Luukku%2015.jpg\"><img border=\"0\" data-original-height=\"306\" data-original-width=\"544\" height=\"180\" src=\"https://blogger.googleusercontent.com/img/b/R29vZ2xl/AVvXsEi6EYdbkaGOdN0...",
    "creator": "Tiina Miettinen",
    "sourceTitle": "Suomen Sukututkimusseura",
    "sheetCategory": "Digital skills + Citizen science",
    "enforcedImage": "https://blogger.googleusercontent.com/img/b/R29vZ2xl/AVvXsEi6EYdbkaGOdN0SfrgKjMrQhQGpRnz5NBNpcJ_gATkTRD9KTFUbtwihlss8lRynHkdnxrFzGgcWZwYLrjfKtmQjdHA-_rHRw33FoTk0qMmk1HZ0BmDniE5ZngtKQ-OJpAi0Jqq2b9UPHNiQvk7yLM-BljqWOqEt2aqIY8AgZ5n7mpRkH-xZbbqN4sgvOVk/s72-c/Luukku%2015.jpg",
    "sourceDescription": "",
    "sourceLogo": "https://www.google.com/s2/favicons?sz=128&domain=suomensukututkimusseura.blogspot.com",
    "lang": "fi",
    "scope": "Finland",
    "isDarkLogo": false,
    "originalRssUrl": "http://suomensukututkimusseura.blogspot.com/feeds/posts/default"
  },
  {
    "title": "Joulukirkkokalenteri 14.12.2024",
    "link": "http://suomensukututkimusseura.blogspot.com/2024/12/joulukirkkokalenteri-14122024.html",
    "pubDate": "2024-12-14T10:00:00.008Z",
    "content": "<html><head></head><body><p>&nbsp;</p><div class=\"separator\"><a href=\"https://blogger.googleusercontent.com/img/b/R29vZ2xl/AVvXsEjiX0nwH2m1zjpCNE-UpPsUfWbXiuMGI12mDEfBrpIWYepIXkjSzwsIvrxGkJD-jFYHgdE9EmKUbI21JUfBZXduuoQ-o06yEnO259AAI27LW_q5AX9piI5ROIsDgoQXpw5bieiNpMBe2yoPrk_VSHOrWN5p20Ziy2bXJWJoZ7-t_EVUNGPm5yu5Voh3Ifc/s544/Luukku%2014.jpg\"><img border=\"0\" data-original-height=\"306\" data-original-width=\"544\" height=\"180\" src=\"https://blogger.googleusercontent.com/img/b/R29vZ2xl/AVvXsEjiX0nwH2m1zjp...",
    "creator": "Tiina Miettinen",
    "sourceTitle": "Suomen Sukututkimusseura",
    "sheetCategory": "Digital skills + Citizen science",
    "enforcedImage": "https://blogger.googleusercontent.com/img/b/R29vZ2xl/AVvXsEjiX0nwH2m1zjpCNE-UpPsUfWbXiuMGI12mDEfBrpIWYepIXkjSzwsIvrxGkJD-jFYHgdE9EmKUbI21JUfBZXduuoQ-o06yEnO259AAI27LW_q5AX9piI5ROIsDgoQXpw5bieiNpMBe2yoPrk_VSHOrWN5p20Ziy2bXJWJoZ7-t_EVUNGPm5yu5Voh3Ifc/s72-c/Luukku%2014.jpg",
    "sourceDescription": "",
    "sourceLogo": "https://www.google.com/s2/favicons?sz=128&domain=suomensukututkimusseura.blogspot.com",
    "lang": "fi",
    "scope": "Finland",
    "isDarkLogo": false,
    "originalRssUrl": "http://suomensukututkimusseura.blogspot.com/feeds/posts/default"
  },
  {
    "title": "Joulukirkkokalenteri 13.12.2024",
    "link": "http://suomensukututkimusseura.blogspot.com/2024/12/joulukirkkokalenteri-13122024.html",
    "pubDate": "2024-12-13T10:00:00.062Z",
    "content": "<html><head></head><body><p>&nbsp;</p><div class=\"separator\"><a href=\"https://blogger.googleusercontent.com/img/b/R29vZ2xl/AVvXsEh8dm1MRqt35tvXbLdlYsjWV-wDN0m6AMhEDkc9JYZl53PtWBlfR7pFje7VZBaWVDoifaycopbXY9V80rRHLvSZH1wA7UaRBIaO_vp3vHD74TU__NREfqGBW3thkjITneq-FRTNkz8Wh50yau55D9KfbrJTkUZChQWgomhlx6_iLOiYUWDdTgosrf1GR0A/s544/luukku13.jpg\"><img border=\"0\" data-original-height=\"306\" data-original-width=\"544\" height=\"180\" src=\"https://blogger.googleusercontent.com/img/b/R29vZ2xl/AVvXsEh8dm1MRqt35tvXbL...",
    "creator": "Tiina Miettinen",
    "sourceTitle": "Suomen Sukututkimusseura",
    "sheetCategory": "Digital skills + Citizen science",
    "enforcedImage": "https://blogger.googleusercontent.com/img/b/R29vZ2xl/AVvXsEh8dm1MRqt35tvXbLdlYsjWV-wDN0m6AMhEDkc9JYZl53PtWBlfR7pFje7VZBaWVDoifaycopbXY9V80rRHLvSZH1wA7UaRBIaO_vp3vHD74TU__NREfqGBW3thkjITneq-FRTNkz8Wh50yau55D9KfbrJTkUZChQWgomhlx6_iLOiYUWDdTgosrf1GR0A/s72-c/luukku13.jpg",
    "sourceDescription": "",
    "sourceLogo": "https://www.google.com/s2/favicons?sz=128&domain=suomensukututkimusseura.blogspot.com",
    "lang": "fi",
    "scope": "Finland",
    "isDarkLogo": false,
    "originalRssUrl": "http://suomensukututkimusseura.blogspot.com/feeds/posts/default"
  },
  {
    "title": "Joulukirkkokalenteri 12.12.2024",
    "link": "http://suomensukututkimusseura.blogspot.com/2024/12/joulukirkkokalenteri-12122024.html",
    "pubDate": "2024-12-12T10:00:00.047Z",
    "content": "<html><head></head><body><p>&nbsp;</p><div class=\"separator\"><a href=\"https://blogger.googleusercontent.com/img/b/R29vZ2xl/AVvXsEjRFy6Q66zFhKIlYwfe-2EVxuFFX70cYRw7wS_cs75DHHkqr2Zi0dERqlYQLN4s2erDxTMxS-1awsqP5T7Yc2KGt-dPYTP59bTH_YLChytjCjNg0zVhQUTmCby8_BxBJV6S_q-pbaYi5GuoYsWbMDjkMRh4c1-GVz-m2pXkI6RDLeJrQOcKw_o-ZSPlhYA/s544/Luukku12.jpg\"><img border=\"0\" data-original-height=\"306\" data-original-width=\"544\" height=\"180\" src=\"https://blogger.googleusercontent.com/img/b/R29vZ2xl/AVvXsEjRFy6Q66zFhKIlYw...",
    "creator": "Tiina Miettinen",
    "sourceTitle": "Suomen Sukututkimusseura",
    "sheetCategory": "Digital skills + Citizen science",
    "enforcedImage": "https://blogger.googleusercontent.com/img/b/R29vZ2xl/AVvXsEjRFy6Q66zFhKIlYwfe-2EVxuFFX70cYRw7wS_cs75DHHkqr2Zi0dERqlYQLN4s2erDxTMxS-1awsqP5T7Yc2KGt-dPYTP59bTH_YLChytjCjNg0zVhQUTmCby8_BxBJV6S_q-pbaYi5GuoYsWbMDjkMRh4c1-GVz-m2pXkI6RDLeJrQOcKw_o-ZSPlhYA/s72-c/Luukku12.jpg",
    "sourceDescription": "",
    "sourceLogo": "https://www.google.com/s2/favicons?sz=128&domain=suomensukututkimusseura.blogspot.com",
    "lang": "fi",
    "scope": "Finland",
    "isDarkLogo": false,
    "originalRssUrl": "http://suomensukututkimusseura.blogspot.com/feeds/posts/default"
  },
  {
    "title": "Joulukalenteri 11.12.2024",
    "link": "http://suomensukututkimusseura.blogspot.com/2024/12/joulukalenteri-11122024.html",
    "pubDate": "2024-12-11T10:00:00.034Z",
    "content": "<html><head></head><body><p><br></p><p></p><div class=\"separator\"><a href=\"https://blogger.googleusercontent.com/img/b/R29vZ2xl/AVvXsEiP6BLV3ey9ngn_lQCoLESmq1r-JyRDOfAeglJ7H0zUwIxS0Xw4a_PNeJG-CYbAjy6cSyCEKzYf4_0ccSToyJzqJwsaOgzRRamhr1UKzBk3crPO05lwRXG3RgTDhm3KsUWpSekwz84WxbtWV8-01qlvrNp1vd_oUE2H_7LhwHP0o1ddwuA692UT03_XNNc/s544/Luukku11.jpg\"><img border=\"0\" data-original-height=\"306\" data-original-width=\"544\" height=\"180\" src=\"https://blogger.googleusercontent.com/img/b/R29vZ2xl/AVvXsEiP6BLV3ey9n...",
    "creator": "Tiina Miettinen",
    "sourceTitle": "Suomen Sukututkimusseura",
    "sheetCategory": "Digital skills + Citizen science",
    "enforcedImage": "https://blogger.googleusercontent.com/img/b/R29vZ2xl/AVvXsEiP6BLV3ey9ngn_lQCoLESmq1r-JyRDOfAeglJ7H0zUwIxS0Xw4a_PNeJG-CYbAjy6cSyCEKzYf4_0ccSToyJzqJwsaOgzRRamhr1UKzBk3crPO05lwRXG3RgTDhm3KsUWpSekwz84WxbtWV8-01qlvrNp1vd_oUE2H_7LhwHP0o1ddwuA692UT03_XNNc/s72-c/Luukku11.jpg",
    "sourceDescription": "",
    "sourceLogo": "https://www.google.com/s2/favicons?sz=128&domain=suomensukututkimusseura.blogspot.com",
    "lang": "fi",
    "scope": "Finland",
    "isDarkLogo": false,
    "originalRssUrl": "http://suomensukututkimusseura.blogspot.com/feeds/posts/default"
  },
  {
    "title": "Joulukirkkokalenteri 10.12.2024",
    "link": "http://suomensukututkimusseura.blogspot.com/2024/12/joulukirkkokalenteri-10122024.html",
    "pubDate": "2024-12-10T10:00:00.012Z",
    "content": "<html><head></head><body><p>&nbsp;</p><div class=\"separator\"><a href=\"https://blogger.googleusercontent.com/img/b/R29vZ2xl/AVvXsEiIOlA6yBr9PR9CpARqGk4A7uST3__FaOphMWhdtwJaqVeOmFepZo4ou0sRUrAceM68LR5dykifSeXlj15xGQDYGCZzupRJ__B_KSiPb-gbcMIYcljzRPgJBWAqwLGrv1E9cSC9ts9IydMYTmqfMg3gqx1yquNSzlTWyR8HdrJfTeKASlDfFRUn2pmF0JY/s544/Luukku10.jpg\"><img border=\"0\" data-original-height=\"306\" data-original-width=\"544\" height=\"180\" src=\"https://blogger.googleusercontent.com/img/b/R29vZ2xl/AVvXsEiIOlA6yBr9PR9CpA...",
    "creator": "Tiina Miettinen",
    "sourceTitle": "Suomen Sukututkimusseura",
    "sheetCategory": "Digital skills + Citizen science",
    "enforcedImage": "https://blogger.googleusercontent.com/img/b/R29vZ2xl/AVvXsEiIOlA6yBr9PR9CpARqGk4A7uST3__FaOphMWhdtwJaqVeOmFepZo4ou0sRUrAceM68LR5dykifSeXlj15xGQDYGCZzupRJ__B_KSiPb-gbcMIYcljzRPgJBWAqwLGrv1E9cSC9ts9IydMYTmqfMg3gqx1yquNSzlTWyR8HdrJfTeKASlDfFRUn2pmF0JY/s72-c/Luukku10.jpg",
    "sourceDescription": "",
    "sourceLogo": "https://www.google.com/s2/favicons?sz=128&domain=suomensukututkimusseura.blogspot.com",
    "lang": "fi",
    "scope": "Finland",
    "isDarkLogo": false,
    "originalRssUrl": "http://suomensukututkimusseura.blogspot.com/feeds/posts/default"
  },
  {
    "title": "Joulukirkkokalenteri 9.12.2024",
    "link": "http://suomensukututkimusseura.blogspot.com/2024/12/joulukirkkokalenteri-9122024.html",
    "pubDate": "2024-12-09T10:00:00.016Z",
    "content": "<html><head></head><body><p>&nbsp;</p><div class=\"separator\"><a href=\"https://blogger.googleusercontent.com/img/b/R29vZ2xl/AVvXsEgdl0fnTL2h_ou9pB2n_rUFhTlRVv3H897zbHM4ccmz6PIvVkFw9zBMeIa99rFYDnbKFN6Pg-7TwJPd1GD0RQp8Pqn2qM4qwhcKb8p1gEWGGoIl20kTBMQTs0VPcQgj5-o0HAq_s2OKXOUkDyAB4nemT_6e23k1Sc33OdHxOTzGlgpI3OoEv7Z2cGIIsXE/s716/Luukku9.jpg\"><img border=\"0\" data-original-height=\"399\" data-original-width=\"716\" height=\"178\" src=\"https://blogger.googleusercontent.com/img/b/R29vZ2xl/AVvXsEgdl0fnTL2h_ou9pB2...",
    "creator": "Tiina Miettinen",
    "sourceTitle": "Suomen Sukututkimusseura",
    "sheetCategory": "Digital skills + Citizen science",
    "enforcedImage": "https://blogger.googleusercontent.com/img/b/R29vZ2xl/AVvXsEgdl0fnTL2h_ou9pB2n_rUFhTlRVv3H897zbHM4ccmz6PIvVkFw9zBMeIa99rFYDnbKFN6Pg-7TwJPd1GD0RQp8Pqn2qM4qwhcKb8p1gEWGGoIl20kTBMQTs0VPcQgj5-o0HAq_s2OKXOUkDyAB4nemT_6e23k1Sc33OdHxOTzGlgpI3OoEv7Z2cGIIsXE/s72-c/Luukku9.jpg",
    "sourceDescription": "",
    "sourceLogo": "https://www.google.com/s2/favicons?sz=128&domain=suomensukututkimusseura.blogspot.com",
    "lang": "fi",
    "scope": "Finland",
    "isDarkLogo": false,
    "originalRssUrl": "http://suomensukututkimusseura.blogspot.com/feeds/posts/default"
  },
  {
    "title": "Joulukirkkokalenteri 8.12.2024",
    "link": "http://suomensukututkimusseura.blogspot.com/2024/12/joulukirkkokalenteri-8122024.html",
    "pubDate": "2024-12-08T10:00:00.009Z",
    "content": "<html><head></head><body><p>&nbsp;</p><div class=\"separator\"><a href=\"https://blogger.googleusercontent.com/img/b/R29vZ2xl/AVvXsEgYQfj4ToGGl3-YsEJaPNDOs2C1AG3907JqENSSMS5clpP7piM8V5ggl5wjRPrSK1yjgWAvFmj7b_fJUqnjGKhOBuQlJKbbqPJ5u7Hf045dOnkn7BocMLCVJGKn-TQs1uD1pkBSfV8MIiTR4Oq0xCMIaSmkD4MbBM_bOfxMD2sbWJoo2OgNV3VAwRFp6dg/s716/Luukku8.jpg\"><img border=\"0\" data-original-height=\"399\" data-original-width=\"716\" height=\"178\" src=\"https://blogger.googleusercontent.com/img/b/R29vZ2xl/AVvXsEgYQfj4ToGGl3-YsEJ...",
    "creator": "Tiina Miettinen",
    "sourceTitle": "Suomen Sukututkimusseura",
    "sheetCategory": "Digital skills + Citizen science",
    "enforcedImage": "https://blogger.googleusercontent.com/img/b/R29vZ2xl/AVvXsEgYQfj4ToGGl3-YsEJaPNDOs2C1AG3907JqENSSMS5clpP7piM8V5ggl5wjRPrSK1yjgWAvFmj7b_fJUqnjGKhOBuQlJKbbqPJ5u7Hf045dOnkn7BocMLCVJGKn-TQs1uD1pkBSfV8MIiTR4Oq0xCMIaSmkD4MbBM_bOfxMD2sbWJoo2OgNV3VAwRFp6dg/s72-c/Luukku8.jpg",
    "sourceDescription": "",
    "sourceLogo": "https://www.google.com/s2/favicons?sz=128&domain=suomensukututkimusseura.blogspot.com",
    "lang": "fi",
    "scope": "Finland",
    "isDarkLogo": false,
    "originalRssUrl": "http://suomensukututkimusseura.blogspot.com/feeds/posts/default"
  },
  {
    "title": "Joulukirkkokalenteri 7.12.2024",
    "link": "http://suomensukututkimusseura.blogspot.com/2024/12/joulukirkkokalenteri-7122024.html",
    "pubDate": "2024-12-07T10:00:00.041Z",
    "content": "<html><head></head><body><p>&nbsp;</p><div class=\"separator\"><a href=\"https://blogger.googleusercontent.com/img/b/R29vZ2xl/AVvXsEhDfV60tsTHpouBVt9nUyOXlTPo15wHTV7oNt9Al7fqJPB6RRYng9281rDMo4GQorQTzrS4pi3jAA104R-zEVWQrKLjOnRtk0SAB4_zR237BXH7-l_aVtDlj4p5AOhuTy9Uqi8aRqigsrWv8mQDpnTjIP9gn3thXCnE7ujfySUTTM3zfUsB6Wj3RKjlxsE/s716/Luukku7.jpg\"><img border=\"0\" data-original-height=\"399\" data-original-width=\"716\" height=\"178\" src=\"https://blogger.googleusercontent.com/img/b/R29vZ2xl/AVvXsEhDfV60tsTHpouBVt9...",
    "creator": "Tiina Miettinen",
    "sourceTitle": "Suomen Sukututkimusseura",
    "sheetCategory": "Digital skills + Citizen science",
    "enforcedImage": "https://blogger.googleusercontent.com/img/b/R29vZ2xl/AVvXsEhDfV60tsTHpouBVt9nUyOXlTPo15wHTV7oNt9Al7fqJPB6RRYng9281rDMo4GQorQTzrS4pi3jAA104R-zEVWQrKLjOnRtk0SAB4_zR237BXH7-l_aVtDlj4p5AOhuTy9Uqi8aRqigsrWv8mQDpnTjIP9gn3thXCnE7ujfySUTTM3zfUsB6Wj3RKjlxsE/s72-c/Luukku7.jpg",
    "sourceDescription": "",
    "sourceLogo": "https://www.google.com/s2/favicons?sz=128&domain=suomensukututkimusseura.blogspot.com",
    "lang": "fi",
    "scope": "Finland",
    "isDarkLogo": false,
    "originalRssUrl": "http://suomensukututkimusseura.blogspot.com/feeds/posts/default"
  },
  {
    "title": "Joulukirkkokalenteri 6.12.2024",
    "link": "http://suomensukututkimusseura.blogspot.com/2024/12/joulukirkkokalenteri-6122024.html",
    "pubDate": "2024-12-06T10:00:00.039Z",
    "content": "<html><head></head><body><p><br></p><div class=\"separator\"><a href=\"https://blogger.googleusercontent.com/img/b/R29vZ2xl/AVvXsEh_sgxr86WgHPY9VW0thklAQrRG6eqLexI0f7DhkB46niXnuvbNxTYxkkeyB9FyDM_drKmBf40ukpNsGeq1YfsUDb1twX5KU27lTXw5VinnCZ446lMnpWLYTWN4IzwQgPBZsWP4c7u39W5ZBXA2WnUs-2c8WkRt11NF_LMVmo83MqmQw4Askq77KcH7bto/s716/Luukku6.jpg\"><img border=\"0\" data-original-height=\"399\" data-original-width=\"716\" height=\"178\" src=\"https://blogger.googleusercontent.com/img/b/R29vZ2xl/AVvXsEh_sgxr86WgHPY9VW0th...",
    "creator": "Tiina Miettinen",
    "sourceTitle": "Suomen Sukututkimusseura",
    "sheetCategory": "Digital skills + Citizen science",
    "enforcedImage": "https://blogger.googleusercontent.com/img/b/R29vZ2xl/AVvXsEh_sgxr86WgHPY9VW0thklAQrRG6eqLexI0f7DhkB46niXnuvbNxTYxkkeyB9FyDM_drKmBf40ukpNsGeq1YfsUDb1twX5KU27lTXw5VinnCZ446lMnpWLYTWN4IzwQgPBZsWP4c7u39W5ZBXA2WnUs-2c8WkRt11NF_LMVmo83MqmQw4Askq77KcH7bto/s72-c/Luukku6.jpg",
    "sourceDescription": "",
    "sourceLogo": "https://www.google.com/s2/favicons?sz=128&domain=suomensukututkimusseura.blogspot.com",
    "lang": "fi",
    "scope": "Finland",
    "isDarkLogo": false,
    "originalRssUrl": "http://suomensukututkimusseura.blogspot.com/feeds/posts/default"
  },
  {
    "title": "Joulukirkkokalenteri 5.12.2024",
    "link": "http://suomensukututkimusseura.blogspot.com/2024/12/joulukirkkokalenteri-5122024.html",
    "pubDate": "2024-12-05T10:00:00.107Z",
    "content": "<html><head></head><body><p>&nbsp;</p><div class=\"separator\"><a href=\"https://blogger.googleusercontent.com/img/b/R29vZ2xl/AVvXsEhNK4A7Xc8DITqab-I7fWYaVIi7RJTFtq_iiZjb_iFVX1tHb8b49esMulQTT_oI2xnD6FnpqgZ-QqyYGkuisiTx8IckuiUaKFT7gQgDWUZVBhzyRwo0BqtCtKmmGxvQSvyFSvZSQZ_XVlix_IrK-cjSaJkPwatHBH6r3vbsucGgoy7llNAuFj5Y8VTjYbc/s716/luukku5.jpg\"><img border=\"0\" data-original-height=\"399\" data-original-width=\"716\" height=\"178\" src=\"https://blogger.googleusercontent.com/img/b/R29vZ2xl/AVvXsEhNK4A7Xc8DITqab-I...",
    "creator": "Tiina Miettinen",
    "sourceTitle": "Suomen Sukututkimusseura",
    "sheetCategory": "Digital skills + Citizen science",
    "enforcedImage": "https://blogger.googleusercontent.com/img/b/R29vZ2xl/AVvXsEhNK4A7Xc8DITqab-I7fWYaVIi7RJTFtq_iiZjb_iFVX1tHb8b49esMulQTT_oI2xnD6FnpqgZ-QqyYGkuisiTx8IckuiUaKFT7gQgDWUZVBhzyRwo0BqtCtKmmGxvQSvyFSvZSQZ_XVlix_IrK-cjSaJkPwatHBH6r3vbsucGgoy7llNAuFj5Y8VTjYbc/s72-c/luukku5.jpg",
    "sourceDescription": "",
    "sourceLogo": "https://www.google.com/s2/favicons?sz=128&domain=suomensukututkimusseura.blogspot.com",
    "lang": "fi",
    "scope": "Finland",
    "isDarkLogo": false,
    "originalRssUrl": "http://suomensukututkimusseura.blogspot.com/feeds/posts/default"
  },
  {
    "title": "Joulukirkkokalenteri 4.12.2024",
    "link": "http://suomensukututkimusseura.blogspot.com/2024/12/joulukirkkokalenteri-4122024.html",
    "pubDate": "2024-12-04T09:30:00.000Z",
    "content": "<html><head></head><body><p>&nbsp;</p><div class=\"separator\"><a href=\"https://blogger.googleusercontent.com/img/b/R29vZ2xl/AVvXsEiC51U-ktgfhIkFk2udb85z8Nju8B247EjDJ-04VxBXJ1-w5XshM4b8wF9e-BIBTbg3GcsJ34_7_nEjCp_luDtCxLooUgPyycwpEtQ9_vN89nK6EtkIaKdEcVxkL_O6ntHSf-KsHupBdQLtV3dTLzId-XuZGdoretIN_vthbnj6ByfIIFJVE49040_c-vI/s544/luukku4.jpg\"><img border=\"0\" data-original-height=\"306\" data-original-width=\"544\" height=\"180\" src=\"https://blogger.googleusercontent.com/img/b/R29vZ2xl/AVvXsEiC51U-ktgfhIkFk2u...",
    "creator": "Tiina Miettinen",
    "sourceTitle": "Suomen Sukututkimusseura",
    "sheetCategory": "Digital skills + Citizen science",
    "enforcedImage": "https://blogger.googleusercontent.com/img/b/R29vZ2xl/AVvXsEiC51U-ktgfhIkFk2udb85z8Nju8B247EjDJ-04VxBXJ1-w5XshM4b8wF9e-BIBTbg3GcsJ34_7_nEjCp_luDtCxLooUgPyycwpEtQ9_vN89nK6EtkIaKdEcVxkL_O6ntHSf-KsHupBdQLtV3dTLzId-XuZGdoretIN_vthbnj6ByfIIFJVE49040_c-vI/s72-c/luukku4.jpg",
    "sourceDescription": "",
    "sourceLogo": "https://www.google.com/s2/favicons?sz=128&domain=suomensukututkimusseura.blogspot.com",
    "lang": "fi",
    "scope": "Finland",
    "isDarkLogo": false,
    "originalRssUrl": "http://suomensukututkimusseura.blogspot.com/feeds/posts/default"
  },
  {
    "title": "Joulukirkkokalenteri 3.12.2024",
    "link": "http://suomensukututkimusseura.blogspot.com/2024/12/joulukirkkokalenteri-3122024.html",
    "pubDate": "2024-12-03T09:30:00.000Z",
    "content": "<html><head></head><body><p>&nbsp;</p><div class=\"separator\"><a href=\"https://blogger.googleusercontent.com/img/b/R29vZ2xl/AVvXsEi_mxDaGe8rx2anFH484tKrIUPYtu-nXq7qptwUV6OW3RMfUX9FCsWoE2bjHyIgdSc41BnJnqi01WFLWdw4zrlRPLCYm8a0yLxO0WkCsCTIWtksmn0zLSTyISLQopd_3TbWu2bZVJ42JycW2-TGFiTI_770-iR0_bNLgPd-5qaBeIPZhx0t552a2GetZK4/s544/luukku3.jpg\"><img border=\"0\" data-original-height=\"306\" data-original-width=\"544\" height=\"180\" src=\"https://blogger.googleusercontent.com/img/b/R29vZ2xl/AVvXsEi_mxDaGe8rx2anFH4...",
    "creator": "Tiina Miettinen",
    "sourceTitle": "Suomen Sukututkimusseura",
    "sheetCategory": "Digital skills + Citizen science",
    "enforcedImage": "https://blogger.googleusercontent.com/img/b/R29vZ2xl/AVvXsEi_mxDaGe8rx2anFH484tKrIUPYtu-nXq7qptwUV6OW3RMfUX9FCsWoE2bjHyIgdSc41BnJnqi01WFLWdw4zrlRPLCYm8a0yLxO0WkCsCTIWtksmn0zLSTyISLQopd_3TbWu2bZVJ42JycW2-TGFiTI_770-iR0_bNLgPd-5qaBeIPZhx0t552a2GetZK4/s72-c/luukku3.jpg",
    "sourceDescription": "",
    "sourceLogo": "https://www.google.com/s2/favicons?sz=128&domain=suomensukututkimusseura.blogspot.com",
    "lang": "fi",
    "scope": "Finland",
    "isDarkLogo": false,
    "originalRssUrl": "http://suomensukututkimusseura.blogspot.com/feeds/posts/default"
  },
  {
    "title": "Joulukirkkokalenteri 2.12.2024",
    "link": "http://suomensukututkimusseura.blogspot.com/2024/12/joulukirkkokalenteri-2122024.html",
    "pubDate": "2024-12-02T10:01:00.000Z",
    "content": "<html><head></head><body><p><br><!--[if gte mso 9]><xml>\n <o:OfficeDocumentSettings>\n  <o:AllowPNG/>\n </o:OfficeDocumentSettings>\n</xml><![endif]--><!--[if gte mso 9]><xml>\n <w:WordDocument>\n  <w:View>Normal</w:View>\n  <w:Zoom>0</w:Zoom>\n  <w:TrackMoves/>\n  <w:TrackFormatting/>\n  <w:HyphenationZone>21</w:HyphenationZone>\n  <w:PunctuationKerning/>\n  <w:ValidateAgainstSchemas/>\n  <w:SaveIfXMLInvalid>false</w:SaveIfXMLInvalid>\n  <w:IgnoreMixedContent>false</w:IgnoreMixedContent>\n  <w:AlwaysShowPlac...",
    "creator": "Tiina Miettinen",
    "sourceTitle": "Suomen Sukututkimusseura",
    "sheetCategory": "Digital skills + Citizen science",
    "enforcedImage": "https://blogger.googleusercontent.com/img/b/R29vZ2xl/AVvXsEgVB4vvG2Hbf6Q6RcI6zYxF63AaIHmUnog36unKA9NDRnwjhtX6km33X0UwEIxru2p5M7BdeNrxydemhqAIr4pMRiyoNOuSqzjQKBPrs311BUD9TdYBA4PXCbCAZqPpWCLAtcV_beKtQp3qfKhgrIZmIgkeO5pDq98IBzvwe-RDQtw1ZJIIyotaoKkwF_Y/s72-c/luukku2.jpg",
    "sourceDescription": "",
    "sourceLogo": "https://www.google.com/s2/favicons?sz=128&domain=suomensukututkimusseura.blogspot.com",
    "lang": "fi",
    "scope": "Finland",
    "isDarkLogo": false,
    "originalRssUrl": "http://suomensukututkimusseura.blogspot.com/feeds/posts/default"
  },
  {
    "title": "Joulukirkkokalenteri 1.12.2024",
    "link": "http://suomensukututkimusseura.blogspot.com/2024/12/joulukirkkokalenteri-1122024.html",
    "pubDate": "2024-12-01T10:00:00.007Z",
    "content": "<html><head></head><body><p><!--[if gte mso 9]><xml>\n <o:OfficeDocumentSettings>\n  <o:AllowPNG/>\n </o:OfficeDocumentSettings>\n</xml><![endif]--><!--[if gte mso 9]><xml>\n <w:WordDocument>\n  <w:View>Normal</w:View>\n  <w:Zoom>0</w:Zoom>\n  <w:TrackMoves/>\n  <w:TrackFormatting/>\n  <w:HyphenationZone>21</w:HyphenationZone>\n  <w:PunctuationKerning/>\n  <w:ValidateAgainstSchemas/>\n  <w:SaveIfXMLInvalid>false</w:SaveIfXMLInvalid>\n  <w:IgnoreMixedContent>false</w:IgnoreMixedContent>\n  <w:AlwaysShowPlacehol...",
    "creator": "Tiina Miettinen",
    "sourceTitle": "Suomen Sukututkimusseura",
    "sheetCategory": "Digital skills + Citizen science",
    "enforcedImage": "https://blogger.googleusercontent.com/img/b/R29vZ2xl/AVvXsEjMLmiKV64MIG7HR9LqIZtmntDSqe2bxQNME9BoWVA7coTwgnwIbtCVdOJsHEgRLWVOGWMrV5B7O8htXf1xIpFi4KZxKK9YjY-kYIhzvxfL7T6Sr0ld23xPwtiovU2wRcuHyeHNe4r-vuJl-pFOIf6ng9CQwUsW1ac3DYDkITQFC3sk5_LRbFTZZJjkmkc/s72-c/Luukku%201.24.jpg",
    "sourceDescription": "",
    "sourceLogo": "https://www.google.com/s2/favicons?sz=128&domain=suomensukututkimusseura.blogspot.com",
    "lang": "fi",
    "scope": "Finland",
    "isDarkLogo": false,
    "originalRssUrl": "http://suomensukututkimusseura.blogspot.com/feeds/posts/default"
  }
]